{
  "schemaVersion": 1,
  "kind": "clip-motion",
  "id": "walk",
  "order": 1,
  "name": "行走",
  "english": "WALK CYCLE",
  "duration": 1.12,
  "description": "普通自然步态，保持稳定步宽与协调摆臂。",
  "method": "CMU 35_01 · 普通行走动捕",
  "focus": [
    "髋膝协同",
    "足部接地",
    "对侧摆臂"
  ],
  "phases": [
    {
      "time": 0,
      "label": "左支撑"
    },
    {
      "time": 0.28,
      "label": "右摆动"
    },
    {
      "time": 0.56,
      "label": "右支撑"
    },
    {
      "time": 0.84,
      "label": "左摆动"
    }
  ],
  "clip": {
    "url": "/models/walk.json",
    "meta": "/models/walk-meta.json"
  },
  "capabilities": {
    "locomotion": "follow"
  }
}
